[
  {
    "payload": {
      "brief": {
        "audience": "Singaporeans relocating",
        "persona": "friendly expat vlogger",
        "text": "Singaporean moving to Shanghai, vlog style",
        "topic": "moving to Shanghai"
      },
      "platforms": ["local"],
      "quantities": {
        "local": 5
      }
    },
    "run_id": "FIXTURE",
    "seq": 1,
    "stage": "planning",
    "ts": "2026-10-03T10:00:00.000Z",
    "type": "run_created"
  },
  {
    "payload": {
      "plan": {
        "brief": {
          "audience": "Singaporeans relocating",
          "persona": "friendly expat vlogger",
          "text": "Singaporean moving to Shanghai, vlog style",
          "topic": "moving to Shanghai"
        },
        "persona_fit_criteria": [
          "Unrelated",
          "Adjacent niche",
          "Same niche, different voice",
          "Close match",
          "Could be the user's own channel"
        ],
        "quantities": {
          "local": 5
        },
        "queries": [
          {
            "lang": "en",
            "platform": "local",
            "query": "shanghai"
          }
        ],
        "rubric_pack": "creator-hooks-v1",
        "run_id": "FIXTURE"
      }
    },
    "run_id": "FIXTURE",
    "seq": 2,
    "stage": "planning",
    "ts": "2026-10-03T10:00:00.500Z",
    "type": "plan_ready"
  },
  {
    "payload": {
      "plan": {
        "brief": {
          "audience": "Singaporeans relocating",
          "persona": "friendly expat vlogger",
          "text": "Singaporean moving to Shanghai, vlog style",
          "topic": "moving to Shanghai"
        },
        "persona_fit_criteria": [
          "Unrelated",
          "Adjacent niche",
          "Same niche, different voice",
          "Close match",
          "Could be the user's own channel"
        ],
        "quantities": {
          "local": 5
        },
        "queries": [
          {
            "lang": "en",
            "platform": "local",
            "query": "shanghai"
          }
        ],
        "rubric_pack": "creator-hooks-v1",
        "run_id": "FIXTURE"
      }
    },
    "run_id": "FIXTURE",
    "seq": 3,
    "stage": "planning",
    "ts": "2026-10-03T10:00:01.500Z",
    "type": "plan_approved"
  },
  {
    "payload": {
      "from": "planning",
      "to": "collecting"
    },
    "run_id": "FIXTURE",
    "seq": 4,
    "stage": "collecting",
    "ts": "2026-10-03T10:00:01.600Z",
    "type": "stage_changed"
  },
  {
    "payload": {
      "post": {
        "collected_at": "2026-10-03T10:00:00Z",
        "media": [],
        "metrics": {
          "comments": 10,
          "likes": 100,
          "views": 1000
        },
        "comments": [
          {
            "likes": 12,
            "text": "relatable!"
          }
        ],
        "creator_display": "Mei",
        "creator_hash": "a1",
        "id": "local:fx-001",
        "kind": "video",
        "lang": "en",
        "platform": "local",
        "raw_ref": "raw/local__fx-001.json",
        "text": {
          "caption": "Stop scrolling. I moved from Singapore to Shanghai with two suitcases.",
          "hashtags": ["shanghai", "expat"],
          "title": "First week in Shanghai"
        },
        "url": "file:///fx/001.mp4"
      }
    },
    "run_id": "FIXTURE",
    "seq": 5,
    "stage": "collecting",
    "ts": "2026-10-03T10:00:02.000Z",
    "type": "post_collected"
  },
  {
    "payload": {
      "post": {
        "collected_at": "2026-10-03T10:00:00Z",
        "media": [],
        "metrics": {
          "comments": 10,
          "likes": 100,
          "views": 1000
        },
        "comments": [
          {
            "likes": 40,
            "text": "太真实了"
          },
          {
            "likes": 8,
            "text": "求租房攻略"
          }
        ],
        "creator_display": "阿杰",
        "creator_hash": "a2",
        "id": "local:fx-002",
        "kind": "video",
        "lang": "zh",
        "platform": "local",
        "raw_ref": "raw/local__fx-002.json",
        "text": {
          "caption": "从新加坡搬到上海的第一周，租房踩了三个坑。",
          "hashtags": ["上海生活", "新加坡人"],
          "title": "新加坡人在上海的第一周"
        },
        "url": "file:///fx/002.mp4"
      }
    },
    "run_id": "FIXTURE",
    "seq": 6,
    "stage": "collecting",
    "ts": "2026-10-03T10:00:02.200Z",
    "type": "post_collected"
  },
  {
    "payload": {
      "post": {
        "collected_at": "2026-10-03T10:00:00Z",
        "media": [],
        "metrics": {
          "comments": 10,
          "likes": 100,
          "views": 1000
        },
        "comments": [],
        "creator_hash": "a3",
        "id": "local:fx-003",
        "kind": "video",
        "lang": "zh",
        "platform": "local",
        "raw_ref": "raw/local__fx-003.json",
        "text": {
          "caption": "上海地铁早高峰 vlog｜一个新加坡人的日常",
          "hashtags": ["vlog"]
        },
        "url": "file:///fx/003.mp4"
      }
    },
    "run_id": "FIXTURE",
    "seq": 7,
    "stage": "collecting",
    "ts": "2026-10-03T10:00:02.400Z",
    "type": "post_collected"
  },
  {
    "payload": {
      "post": {
        "collected_at": "2026-10-03T10:00:00Z",
        "media": [],
        "metrics": {
          "comments": 10,
          "likes": 100,
          "views": 1000
        },
        "comments": [
          {
            "likes": 3,
            "text": "saving this"
          }
        ],
        "creator_hash": "a4",
        "id": "local:fx-004",
        "kind": "image_note",
        "lang": "en",
        "platform": "local",
        "raw_ref": "raw/local__fx-004.json",
        "text": {
          "caption": "7 things I wish I knew before signing.",
          "hashtags": ["shanghai", "checklist"],
          "title": "Shanghai apartment hunting checklist"
        },
        "url": "file:///fx/004"
      }
    },
    "run_id": "FIXTURE",
    "seq": 8,
    "stage": "collecting",
    "ts": "2026-10-03T10:00:02.600Z",
    "type": "post_collected"
  },
  {
    "payload": {
      "post": {
        "collected_at": "2026-10-03T10:00:00Z",
        "media": [],
        "metrics": {
          "comments": 10,
          "likes": 100,
          "views": 1000
        },
        "comments": [
          {
            "likes": 5,
            "text": "有用"
          }
        ],
        "creator_hash": "a5",
        "id": "local:fx-005",
        "kind": "image_note",
        "lang": "zh",
        "platform": "local",
        "raw_ref": "raw/local__fx-005.json",
        "text": {
          "caption": "新加坡护照办卡需要的材料清单。",
          "hashtags": ["上海", "攻略"],
          "title": "在上海办银行卡全攻略"
        },
        "url": "file:///fx/005"
      }
    },
    "run_id": "FIXTURE",
    "seq": 9,
    "stage": "collecting",
    "ts": "2026-10-03T10:00:02.800Z",
    "type": "post_collected"
  },
  {
    "payload": {
      "from": "collecting",
      "to": "pass_one"
    },
    "run_id": "FIXTURE",
    "seq": 10,
    "stage": "pass_one",
    "ts": "2026-10-03T10:00:03.200Z",
    "type": "stage_changed"
  },
  {
    "payload": {
      "composite": 0.7,
      "judge": {
        "answers": {
          "format_guess": {
            "confidence": 0.5,
            "probabilities": {
              "image_carousel": 0.3,
              "talking_head": 0.1,
              "vlog_montage": 0.6
            },
            "type": "choice",
            "value": "vlog_montage"
          },
          "niche_relevance": {
            "confidence": 0.7,
            "legend": {
              "1": "Unrelated",
              "2": "Mentions in passing",
              "3": "Partly about it",
              "4": "Mainly about it",
              "5": "Entirely about it"
            },
            "probabilities": {
              "1": 0,
              "2": 0.1,
              "3": 0.3,
              "4": 0.5,
              "5": 0.1
            },
            "type": "score",
            "value": 3.2
          }
        },
        "input_tokens": 900,
        "latency_ms": 120,
        "model": "jev-1.13.0",
        "pass_name": "pass_one",
        "post_id": "local:fx-001"
      },
      "kept": true
    },
    "run_id": "FIXTURE",
    "seq": 11,
    "stage": "pass_one",
    "ts": "2026-10-03T10:00:03.400Z",
    "type": "pass_one_judged"
  },
  {
    "payload": {
      "composite": 0.7,
      "judge": {
        "answers": {
          "format_guess": {
            "confidence": 0.5,
            "probabilities": {
              "image_carousel": 0.3,
              "talking_head": 0.1,
              "vlog_montage": 0.6
            },
            "type": "choice",
            "value": "vlog_montage"
          },
          "niche_relevance": {
            "confidence": 0.7,
            "legend": {
              "1": "Unrelated",
              "2": "Mentions in passing",
              "3": "Partly about it",
              "4": "Mainly about it",
              "5": "Entirely about it"
            },
            "probabilities": {
              "1": 0,
              "2": 0.1,
              "3": 0.3,
              "4": 0.5,
              "5": 0.1
            },
            "type": "score",
            "value": 3.8000000000000003
          }
        },
        "input_tokens": 910,
        "latency_ms": 120,
        "model": "jev-1.13.0",
        "pass_name": "pass_one",
        "post_id": "local:fx-002"
      },
      "kept": true
    },
    "run_id": "FIXTURE",
    "seq": 12,
    "stage": "pass_one",
    "ts": "2026-10-03T10:00:03.550Z",
    "type": "pass_one_judged"
  },
  {
    "payload": {
      "composite": 0.7,
      "judge": {
        "answers": {
          "format_guess": {
            "confidence": 0.5,
            "probabilities": {
              "image_carousel": 0.3,
              "talking_head": 0.1,
              "vlog_montage": 0.6
            },
            "type": "choice",
            "value": "vlog_montage"
          },
          "niche_relevance": {
            "confidence": 0.7,
            "legend": {
              "1": "Unrelated",